{
  "schema": "labview-benchmark-actor/boot-benchmark-v1",
  "iteration": "collab-cli-v0.11.0",
  "sessionId": "win-1785424878117",
  "sealedAt": "2026-07-30T15:22:49.651Z",
  "plane": "WIN",
  "hypervisor": "vmware",
  "capture": {
    "backend": "vmware-vnc",
    "transport": "vnc://127.0.0.1:5901 framebuffer (RemoteDisplay.vnc)",
    "cadenceHz": 2,
    "vm": "C:\\stage\\actor-golden\\actor-golden.vmx"
  },
  "procedure": {
    "id": "mesh-actor-boot",
    "milestones": [
      "BOOT-START",
      "LBABUS-BUILD-START",
      "LBABUS-BUILT"
    ]
  },
  "fingerprintAlgo": "dhash-64",
  "fingerprintSpecVersion": 1,
  "anchor": {
    "source": "host-capture-timeline",
    "hostT0MonotonicMs": 38.6981,
    "hostClock": "monotonic-ms",
    "guestClock": "journald-short-monotonic",
    "correlation": {
      "method": "serial-pin+journal-monotonic",
      "allMilestonesPinned": true,
      "skewToleranceMs": 500,
      "pins": [
        {
          "caseId": "BOOT-START",
          "frameIndex": 14,
          "hostMonotonicMs": 11854.2376,
          "guestMonotonicMs": 5015,
          "serialMonotonicMs": 5010,
          "skewMs": 5
        },
        {
          "caseId": "LBABUS-BUILD-START",
          "frameIndex": 14,
          "hostMonotonicMs": 11854.2376,
          "guestMonotonicMs": 5186,
          "serialMonotonicMs": 5170,
          "skewMs": 16
        },
        {
          "caseId": "LBABUS-BUILT",
          "frameIndex": 24,
          "hostMonotonicMs": 17939.4473,
          "guestMonotonicMs": 11360,
          "serialMonotonicMs": 11350,
          "skewMs": 10
        }
      ]
    }
  },
  "frames": [
    {
      "index": 0,
      "hostMonotonicMs": 3254.0382,
      "perceptualFingerprint": "0000000000000000",
      "integrityHash": "10f4d37bc929077c1d41b064466013afdccb783a7fb766897ecf6f85d84b63f0"
    },
    {
      "index": 1,
      "hostMonotonicMs": 4428.3495,
      "perceptualFingerprint": "0000000000000000",
      "integrityHash": "a31446594d9210a0b55cc8c6af7691f5d3e5a96c4aacc45e31269e786d3de3ef"
    },
    {
      "index": 2,
      "hostMonotonicMs": 4997.0296,
      "perceptualFingerprint": "0000000000000000",
      "integrityHash": "10f4d37bc929077c1d41b064466013afdccb783a7fb766897ecf6f85d84b63f0"
    },
    {
      "index": 3,
      "hostMonotonicMs": 5575.1799,
      "perceptualFingerprint": "0000000000000000",
      "integrityHash": "10f4d37bc929077c1d41b064466013afdccb783a7fb766897ecf6f85d84b63f0"
    },
    {
      "index": 4,
      "hostMonotonicMs": 6142.1033,
      "perceptualFingerprint": "0000000000000000",
      "integrityHash": "a31446594d9210a0b55cc8c6af7691f5d3e5a96c4aacc45e31269e786d3de3ef"
    },
    {
      "index": 5,
      "hostMonotonicMs": 6713.744,
      "perceptualFingerprint": "0000000000000000",
      "integrityHash": "a31446594d9210a0b55cc8c6af7691f5d3e5a96c4aacc45e31269e786d3de3ef"
    },
    {
      "index": 6,
      "hostMonotonicMs": 7274.8824,
      "perceptualFingerprint": "0000000000000000",
      "integrityHash": "a31446594d9210a0b55cc8c6af7691f5d3e5a96c4aacc45e31269e786d3de3ef"
    },
    {
      "index": 7,
      "hostMonotonicMs": 7837.4547,
      "perceptualFingerprint": "0000000000000000",
      "integrityHash": "5786293636c3fb5652c22e062aface3d4e736989cb2e8dfa49c4535d53665bf1"
    },
    {
      "index": 8,
      "hostMonotonicMs": 8408.1499,
      "perceptualFingerprint": "0000000000000000",
      "integrityHash": "5786293636c3fb5652c22e062aface3d4e736989cb2e8dfa49c4535d53665bf1"
    },
    {
      "index": 9,
      "hostMonotonicMs": 8975.5205,
      "perceptualFingerprint": "0000000000000000",
      "integrityHash": "a31446594d9210a0b55cc8c6af7691f5d3e5a96c4aacc45e31269e786d3de3ef"
    },
    {
      "index": 10,
      "hostMonotonicMs": 9540.9601,
      "perceptualFingerprint": "0000000000000000",
      "integrityHash": "a31446594d9210a0b55cc8c6af7691f5d3e5a96c4aacc45e31269e786d3de3ef"
    },
    {
      "index": 11,
      "hostMonotonicMs": 10102.8596,
      "perceptualFingerprint": "0000000000000000",
      "integrityHash": "a31446594d9210a0b55cc8c6af7691f5d3e5a96c4aacc45e31269e786d3de3ef"
    },
    {
      "index": 12,
      "hostMonotonicMs": 10651.013,
      "perceptualFingerprint": "0000000000000000",
      "integrityHash": "a31446594d9210a0b55cc8c6af7691f5d3e5a96c4aacc45e31269e786d3de3ef"
    },
    {
      "index": 13,
      "hostMonotonicMs": 11242.2711,
      "perceptualFingerprint": "0000000000000008",
      "integrityHash": "d0b89b2fdd00a1508db18a915591ebdc4bb4941e6edd423725e12448fa266899"
    },
    {
      "index": 14,
      "hostMonotonicMs": 11854.2376,
      "perceptualFingerprint": "0000000000000008",
      "integrityHash": "1c07bc17158be50064b2836c6e4c58b35f20f7396177e315a23ecf6a96d84801",
      "caseId": "LBABUS-BUILD-START",
      "guestMonotonicMs": 5186,
      "settled": true
    },
    {
      "index": 15,
      "hostMonotonicMs": 12476.8791,
      "perceptualFingerprint": "0000000000000008",
      "integrityHash": "8c06e58367228304a57eed232e2ed177cdd1d6973655e0a105257a1335b287a6"
    },
    {
      "index": 16,
      "hostMonotonicMs": 13087.8154,
      "perceptualFingerprint": "0000000000000008",
      "integrityHash": "8c06e58367228304a57eed232e2ed177cdd1d6973655e0a105257a1335b287a6"
    },
    {
      "index": 17,
      "hostMonotonicMs": 13698.4159,
      "perceptualFingerprint": "0000000000000008",
      "integrityHash": "8c06e58367228304a57eed232e2ed177cdd1d6973655e0a105257a1335b287a6"
    },
    {
      "index": 18,
      "hostMonotonicMs": 14309.3912,
      "perceptualFingerprint": "0000000000000008",
      "integrityHash": "8c06e58367228304a57eed232e2ed177cdd1d6973655e0a105257a1335b287a6"
    },
    {
      "index": 19,
      "hostMonotonicMs": 14919.5441,
      "perceptualFingerprint": "0000000000000008",
      "integrityHash": "8c06e58367228304a57eed232e2ed177cdd1d6973655e0a105257a1335b287a6"
    },
    {
      "index": 20,
      "hostMonotonicMs": 15526.5037,
      "perceptualFingerprint": "0000000000000008",
      "integrityHash": "afcfc2b19a717b45c683ca3f1e316e502f4b9abe13ec7270b79562e5d0a219e0"
    },
    {
      "index": 21,
      "hostMonotonicMs": 16134.2489,
      "perceptualFingerprint": "0000000000000008",
      "integrityHash": "27da11992b6dd1ef7e501fc18e22e9fb73005503d9e5e8b477d0c0c03768f292"
    },
    {
      "index": 22,
      "hostMonotonicMs": 16744.212,
      "perceptualFingerprint": "0000000000000008",
      "integrityHash": "27da11992b6dd1ef7e501fc18e22e9fb73005503d9e5e8b477d0c0c03768f292"
    },
    {
      "index": 23,
      "hostMonotonicMs": 17341.8062,
      "perceptualFingerprint": "0000000000000008",
      "integrityHash": "27da11992b6dd1ef7e501fc18e22e9fb73005503d9e5e8b477d0c0c03768f292"
    },
    {
      "index": 24,
      "hostMonotonicMs": 17939.4473,
      "perceptualFingerprint": "0000000000000008",
      "integrityHash": "27da11992b6dd1ef7e501fc18e22e9fb73005503d9e5e8b477d0c0c03768f292",
      "caseId": "LBABUS-BUILT",
      "guestMonotonicMs": 11360,
      "settled": true
    },
    {
      "index": 25,
      "hostMonotonicMs": 18539.8581,
      "perceptualFingerprint": "0000000000000008",
      "integrityHash": "27da11992b6dd1ef7e501fc18e22e9fb73005503d9e5e8b477d0c0c03768f292"
    },
    {
      "index": 26,
      "hostMonotonicMs": 19132.8142,
      "perceptualFingerprint": "0000000000000008",
      "integrityHash": "27da11992b6dd1ef7e501fc18e22e9fb73005503d9e5e8b477d0c0c03768f292"
    },
    {
      "index": 27,
      "hostMonotonicMs": 19729.1222,
      "perceptualFingerprint": "0000000000000008",
      "integrityHash": "27da11992b6dd1ef7e501fc18e22e9fb73005503d9e5e8b477d0c0c03768f292"
    },
    {
      "index": 28,
      "hostMonotonicMs": 20324.7551,
      "perceptualFingerprint": "0000000000000008",
      "integrityHash": "27da11992b6dd1ef7e501fc18e22e9fb73005503d9e5e8b477d0c0c03768f292"
    },
    {
      "index": 29,
      "hostMonotonicMs": 20929.2539,
      "perceptualFingerprint": "0000000000000008",
      "integrityHash": "27da11992b6dd1ef7e501fc18e22e9fb73005503d9e5e8b477d0c0c03768f292"
    },
    {
      "index": 30,
      "hostMonotonicMs": 21531.0995,
      "perceptualFingerprint": "0000000000000008",
      "integrityHash": "27da11992b6dd1ef7e501fc18e22e9fb73005503d9e5e8b477d0c0c03768f292"
    },
    {
      "index": 31,
      "hostMonotonicMs": 22129.8892,
      "perceptualFingerprint": "0000000000000008",
      "integrityHash": "27da11992b6dd1ef7e501fc18e22e9fb73005503d9e5e8b477d0c0c03768f292"
    },
    {
      "index": 32,
      "hostMonotonicMs": 22730.6184,
      "perceptualFingerprint": "0000000000000008",
      "integrityHash": "27da11992b6dd1ef7e501fc18e22e9fb73005503d9e5e8b477d0c0c03768f292"
    },
    {
      "index": 33,
      "hostMonotonicMs": 23328.3781,
      "perceptualFingerprint": "0000000000000008",
      "integrityHash": "27da11992b6dd1ef7e501fc18e22e9fb73005503d9e5e8b477d0c0c03768f292"
    },
    {
      "index": 34,
      "hostMonotonicMs": 23927.4577,
      "perceptualFingerprint": "0000000000000008",
      "integrityHash": "27da11992b6dd1ef7e501fc18e22e9fb73005503d9e5e8b477d0c0c03768f292"
    },
    {
      "index": 35,
      "hostMonotonicMs": 24528.7275,
      "perceptualFingerprint": "0000000000000008",
      "integrityHash": "27da11992b6dd1ef7e501fc18e22e9fb73005503d9e5e8b477d0c0c03768f292"
    },
    {
      "index": 36,
      "hostMonotonicMs": 25123.8284,
      "perceptualFingerprint": "0000000000000008",
      "integrityHash": "27da11992b6dd1ef7e501fc18e22e9fb73005503d9e5e8b477d0c0c03768f292"
    },
    {
      "index": 37,
      "hostMonotonicMs": 25715.7142,
      "perceptualFingerprint": "0000000000000008",
      "integrityHash": "27da11992b6dd1ef7e501fc18e22e9fb73005503d9e5e8b477d0c0c03768f292"
    },
    {
      "index": 38,
      "hostMonotonicMs": 26313.5061,
      "perceptualFingerprint": "0000000000000008",
      "integrityHash": "27da11992b6dd1ef7e501fc18e22e9fb73005503d9e5e8b477d0c0c03768f292"
    },
    {